UUID,Modified,Creator,Publisher,Title,DatasetURI,Description,TopicCategory,DateIssued,Formats,Links
b91817ba-8118-4a50-b431-f0ac2c85d885,2016-11-18T22:43:26.933116,Streets Department,City of Philadelphia,Zip Codes,zip-codes,"The purpose of this dataset is to represent the Zip Code areas for the City of Philadelphia.  The edges of Zip Codes are slightly modified for logical and cartographic purposes.

Trouble downloading or have questions about this City dataset? Visit the [OpenDataPhilly Discussion Group](http://www.phila.gov/data/discuss/)",Uncategorized,2014-12-08T22:19:07.861855,"CSV, KML, shp, geojson, api, HTML","http://data.phl.opendata.arcgis.com/datasets/b54ec5210cee41c3a884c9086f7af1be_0.csv, http://data.phl.opendata.arcgis.com/datasets/b54ec5210cee41c3a884c9086f7af1be_0.kml, http://data.phl.opendata.arcgis.com/datasets/b54ec5210cee41c3a884c9086f7af1be_0.zip, http://data.phl.opendata.arcgis.com/datasets/b54ec5210cee41c3a884c9086f7af1be_0.geojson, https://services.arcgis.com/fLeGjb7u4uXqeF9q/arcgis/rest/services/Zipcodes_Poly/FeatureServer/0/query?outFields=*&where=1%3D1, http://metadata.phila.gov/#home/datasetdetails/555f813af15fcb6c6ed44153/representationdetails/5589aa52b80410802d7e643b/, http://data.phl.opendata.arcgis.com/datasets/ad233733f89242af9a1f9e52d60d1e4e_0.csv, http://data.phl.opendata.arcgis.com/datasets/ad233733f89242af9a1f9e52d60d1e4e_0.kml, http://data.phl.opendata.arcgis.com/datasets/ad233733f89242af9a1f9e52d60d1e4e_0.zip, https://services.arcgis.com/fLeGjb7u4uXqeF9q/arcgis/rest/services/Zipcodes_Arc/FeatureServer/0/query?outFields=*&where=1%3D1, http://data.phl.opendata.arcgis.com/datasets/ad233733f89242af9a1f9e52d60d1e4e_0.geojson, http://metadata.phila.gov/#home/datasetdetails/555f813af15fcb6c6ed44153/representationdetails/5571b1cae4fb1d91393c21cc/"
ca7e8387-a212-45cb-9416-9c49f32c4756,2016-11-18T22:30:48.288555,Police Department,City of Philadelphia,Police Service Areas,police-service-areas,"There are currently 65 Police Service Areas (PSA) boundaries in Philadelphia with two to four per District. These boundaries replaced a much smaller boundary, Sectors in 2009. In several Districts, PSA's split Sector boundaries and therefore a historical comparison would not necessarily be accurate.

Trouble downloading or have questions about this City dataset? Visit the [OpenDataPhilly Discussion Group](http://www.phila.gov/data/discuss/)",Public Safety,2014-12-08T22:34:27.848090,"CSV, KML, shp, geojson, api, HTML","http://data.phl.opendata.arcgis.com/datasets/8dc58605f9dd484295c7d065694cdc0f_0.csv, http://data.phl.opendata.arcgis.com/datasets/8dc58605f9dd484295c7d065694cdc0f_0.kml, http://data.phl.opendata.arcgis.com/datasets/8dc58605f9dd484295c7d065694cdc0f_0.zip, http://data.phl.opendata.arcgis.com/datasets/8dc58605f9dd484295c7d065694cdc0f_0.geojson, https://services.arcgis.com/fLeGjb7u4uXqeF9q/arcgis/rest/services/Boundaries_PSA/FeatureServer/0/query?outFields=*&where=1%3D1, http://metadata.phila.gov/#home/datasetdetails/5543864420583086178c4e75/representationdetails/55438a809b989a05172d0cf4/"
071c512a-a455-4312-942f-60f6c7a797de,2016-08-25T03:57:39.320618,,Natural Resources Conservation Service,"Soil Survey, Philadelphia County",soil-survey-philadelphia-county,"A digital survey of the types and distributions of soils on the landscape of Philadelphia County in 2005, developed by the U.S. Department of Agriculture's Natural Resource Conservation Service through its Soil Survey Geographic database (SSURGO). Consists of geo-referenced digital maps and attribute data. Includes an optional soil features map layer for features too small to delineate at the mapping scale but large and contrasting enough to significantly influence land use and management. Digital versions of hydrography, cultural features, and other associated layers are not part of SSURGO data and are thus not featured.
",Environment,2014-12-08T22:16:34.499464,"XML, HTML, shp","http://www.pasda.psu.edu/pasda/UCI_Metadata/philadelphiacountysoils2005.xml, http://www.pasda.psu.edu/uci/FullMetadataDisplay.aspx?file=philadelphiacountysoils2005.xml, http://www.pasda.psu.edu/data/soils/Philadelphia_wss_SSA_PA101_soildb_PA_2003_[2014-09-23].zip"
64d6bb82-5731-48d5-a94d-94dc071ecaa6,2016-08-25T03:55:10.097628,,PA Department of Human Services,Child Care Search,child-care-search,"Child Care Search is a searchable database, which yields results on child care services suited to parameters first of child age, then desired program focus, and finally by location (county). Users follow step-by-step input instructions to create a center/institute profile type, which the database tool then tries to match most closely. In addition to location and contact information, qualitative information about care centers (STAR rating system ran) are also available. All information results are freely viewable and printable, but not exportable.",Health / Human Services,2014-12-08T22:27:45.870007,HTML,https://www.compass.state.pa.us/compass.web/ProviderSearch/pgm/PSWEL.aspx
0887d173-9d60-4240-a1ab-25589bc1c3aa,2016-08-25T03:24:30.232450,,Federal Insurance and Mitigation Administration (FEMA),Flood Hazard Zone Lines,flood-hazard-zone-lines,"Data developed by the Federal Emergency Management Agency (FEMA) with information from its Digital Flood Insurance Rate Map (DFIRM) Database, capturing flood risk information and supporting data for Philadelphia County. Data consists of geo-referenced digital maps and attribute data.  Risk classifications used in the data are: 1% annual-chance flood event; 0.2% annual-chance flood event; and areas of minimal flood risk. ","Environment, Planning / Zoning",2014-12-08T22:51:24.663414,"HTML, XML, shp","http://www.pasda.psu.edu/uci/FullMetadataDisplay.aspx?file=NFHL_Pennsylvania.xml, http://www.pasda.psu.edu/pasda/UCI_Metadata/NFHL_Pennsylvania.xml, ftp://www.pasda.psu.edu/pub/pasda/fema/FEMA_NFHL_42017C_Bucks_County_20120504.zip, ftp://www.pasda.psu.edu/pub/pasda/fema/FEMA_NFHL_42017C_Bucks_County20150316.zip, ftp://www.pasda.psu.edu/pub/pasda/fema/FEMA_NFHL_42017C_Bucks_County_20160323.zip, ftp://www.pasda.psu.edu/pub/pasda/fema/FEMA_NFHL_42029C_Chester_County_20130922.zip, ftp://www.pasda.psu.edu/pub/pasda/fema/FEMA_NFHL_42029C_Chester_County20150205.zip, ftp://www.pasda.psu.edu/pub/pasda/fema/FEMA_NFHL_42029C_Chester_County_20160425.zip, ftp://www.pasda.psu.edu/pub/pasda/fema/FEMA_NFHL_42091C_Montgomery_County_20130814.zip, ftp://www.pasda.psu.edu/pub/pasda/fema/FEMA_NFHL_42091C_Montgomery_County20150402.zip, ftp://www.pasda.psu.edu/pub/pasda/fema/FEMA_NFHL_42091C_Montgomery_County_20160301.zip, ftp://www.pasda.psu.edu/pub/pasda/fema/FEMA_NFHL_420757_Philadelphia_City_20151117.zip"
fbd6d836-4cbf-4264-9bfb-bf41227aa535,2016-08-23T23:00:39.431508,,City of Philadelphia,Professional Services Contracts,professional-services-contract-data,"The entire dataset for Professional Services Contracts by fiscal quarter are available for download in a Microsoft ExcelÂ® compatible CSV format below. 

The City of Philadelphia, through a joint effort among the Finance Department, Chief Integrity Officer and the Office of Innovation and Technology (OIT), launched an online, open data website for City contracts. The site provides data on the Cityâ€™s professional services contracts in a searchable format and includes a breakdown of contract dollars by vendor, department and service type. It also features a â€œfrequently asked questionsâ€ section to help users understand the available data: http://cityofphiladelphia.github.io/contracts/.  

Trouble downloading or have questions about this City dataset? Visit the [OpenDataPhilly Discussion Group](http://www.phila.gov/data/discuss/)","Arts / Culture / History, Budget / Finance",2014-12-08T22:38:54.946558,"CSV, HTML","https://raw.githubusercontent.com/CityOfPhiladelphia/contracts/gh-pages/professional-services/data/FY-2013-Q4.csv, https://raw.githubusercontent.com/CityOfPhiladelphia/contracts/gh-pages/professional-services/data/FY-2014-Q1.csv, https://raw.githubusercontent.com/CityOfPhiladelphia/contracts/gh-pages/professional-services/data/FY-2014-Q2.csv, https://raw.githubusercontent.com/CityOfPhiladelphia/contracts/gh-pages/professional-services/data/FY-2014-Q3.csv, https://raw.githubusercontent.com/CityOfPhiladelphia/contracts/gh-pages/professional-services/data/FY-2014-Q4.csv, https://raw.githubusercontent.com/CityOfPhiladelphia/contracts/gh-pages/professional-services/data/FY-2015-Q1.csv, https://raw.githubusercontent.com/CityOfPhiladelphia/contracts/gh-pages/professional-services/data/FY-2015-Q2.csv, https://raw.githubusercontent.com/CityOfPhiladelphia/contracts/gh-pages/professional-services/data/FY-2015-Q3.csv, https://raw.githubusercontent.com/CityOfPhiladelphia/contracts/gh-pages/professional-services/data/FY-2015-Q4.csv, https://raw.githubusercontent.com/CityOfPhiladelphia/contracts/gh-pages/professional-services/data/FY-2016-Q1.csv, https://raw.githubusercontent.com/CityOfPhiladelphia/contracts/gh-pages/professional-services/data/FY-2016-Q2.csv, https://raw.githubusercontent.com/CityOfPhiladelphia/contracts/gh-pages/professional-services/data/FY-2016-Q3.csv, https://raw.githubusercontent.com/CityOfPhiladelphia/contracts/gh-pages/professional-services/data/FY-2016-Q4.csv, http://metadata.phila.gov/#home/datasetdetails/5543868420583086178c4f7c/"
aab8b00c-a577-4c85-923a-77958e12e4f4,2016-08-16T13:54:26.552203,"DVRPC, Freight, Rail, Transportation",Delaware Valley Regional Planning Commission (DVRPC),DVRPC Freight Rail,dvrpc-freight-rail,The DVRPC Freight Rail Line data layer was developed to identify key ownership and operation details for freight rail lines in the Delaware Valley. This data set was developed internally using various rail mapping and track chart sources. The polyline network represents rights-of-way rather than track and is segmented based on subdivision or track name as well as key profile details. The line set has been developed with input from various Class I and short-line railroads in the region.,Transportation,2016-08-16T13:52:59.204610,"api, geojson, CSV, shp","http://arcgis.dvrpc.org/arcgis/rest/services/Freight/FreightRail/FeatureServer/0, http://dvrpc.dvrpcgis.opendata.arcgis.com/datasets/84b240b06d6c4359b61b39cab0c50200_0.geojson, http://dvrpc.dvrpcgis.opendata.arcgis.com/datasets/84b240b06d6c4359b61b39cab0c50200_0.csv, http://dvrpc.dvrpcgis.opendata.arcgis.com/datasets/84b240b06d6c4359b61b39cab0c50200_0.zip"
bbbcac77-16cf-4384-a700-ab70a47bc16b,2016-08-16T13:49:42.261519,"Airport, DVRPC, Transportation",Delaware Valley Regional Planning Commission (DVRPC),DVRPC Airports and Airport Footprints,dvrpc-airports-and-airport-footprints,The DVRPC airports data set includes the property areas of all commercial and reliever airports in the Delaware Valley. Annual operations are extracted from FAA records or based upon the DVRPC counting program.,Transportation,2016-08-16T13:45:40.437115,"api, geojson, CSV, shp","http://arcgis.dvrpc.org/arcgis/rest/services/Freight/Airports/FeatureServer/0, http://dvrpc.dvrpcgis.opendata.arcgis.com/datasets/3b3be5edd9f849968f19b205fad92697_0.geojson, http://dvrpc.dvrpcgis.opendata.arcgis.com/datasets/3b3be5edd9f849968f19b205fad92697_0.csv, http://dvrpc.dvrpcgis.opendata.arcgis.com/datasets/3b3be5edd9f849968f19b205fad92697_0.zip, http://arcgis.dvrpc.org/arcgis/rest/services/Transportation/AirportFootprints/FeatureServer/0, http://dvrpc.dvrpcgis.opendata.arcgis.com/datasets/e80b5a96ae07464abeba15e58874ed57_0.geojson, http://dvrpc.dvrpcgis.opendata.arcgis.com/datasets/e80b5a96ae07464abeba15e58874ed57_0.csv, http://dvrpc.dvrpcgis.opendata.arcgis.com/datasets/e80b5a96ae07464abeba15e58874ed57_0.zip"
20def466-1fe8-4731-9cfb-60b7b5d8eebc,2016-08-15T17:35:11.769787,"DVRPC, Economy, Freight, Intermodal, Ports, Transportation",Delaware Valley Regional Planning Commission (DVRPC),Philly Freight Finder,philly-freight-finder,"Freight Data Portal for the Delaware Valley.

The Delaware Valley is a premier freight transportation gateway. It possesses one of the world's busiest freshwater ports; rail freight service from two large Class I railroads and 12 smaller short lines; an airport with expanding international cargo services; an excellent highway and connector network; and numerous rail and port intermodal terminals.

The performance of this extraordinary network helps promote and support a thriving economy. PhillyFreightFinder is a resource for exploring and tracking the Philadelphia-Camden-Trenton regional freight network.

Open Freight App is a project by the Delaware Valley Regional Planning Commission (DVRPC) to share with regional and national transportation planning partners the framework that is the basis for the PhillyFreightFinder web mapping and data application. Through this effort, DVRPC hopes that county planning agencies, metropolitan planning organizations and state departments of transportation, and economic development agencies can leverage this framework to further their efforts in making freight transportation data public. By utilizing the Open Freight App framework, rather than building from scratch, planning agencies can focus their time and resources on the development of data sets that can serve to improve the access to information on freight facilities and their role in economic development and transportation across the country. Open Freight App would serve as a self-hosted solution to offer these datasets to other planners, economic developers, public officials, decision-makers and the general public.",Transportation,2016-08-15T17:19:42.213814,HTML,http://dvrpc.org/webmaps/PhillyFreightFinder/
b8f0bb2c-108c-49ee-ae53-f291239645c9,2016-08-15T17:13:09.812002,"Amtrak, DVRPC, NJTransit, Rail, SEPTA, Transit, Transportation",Delaware Valley Regional Planning Commission (DVRPC),DVRPC Passenger Rail and Stations,dvrpc-passenger-rail,Passenger rail in the DVRPC Region.,Transportation,2016-08-15T17:05:56.690509,"api, geojson, CSV, shp","http://arcgis.dvrpc.org/arcgis/rest/services/Transportation/PassengerRail/FeatureServer/0, http://dvrpc.dvrpcgis.opendata.arcgis.com/datasets/5af7a3e9c0f34a7f93ac8935cb6cae3b_0.geojson, http://dvrpc.dvrpcgis.opendata.arcgis.com/datasets/5af7a3e9c0f34a7f93ac8935cb6cae3b_0.csv, http://dvrpc.dvrpcgis.opendata.arcgis.com/datasets/5af7a3e9c0f34a7f93ac8935cb6cae3b_0.zip, http://arcgis.dvrpc.org/arcgis/rest/services/Transportation/PassengerRailStations/FeatureServer/0, http://dvrpc.dvrpcgis.opendata.arcgis.com/datasets/68b970bf65bc411c8a7f8f7b0bb7908d_0.geojson, http://dvrpc.dvrpcgis.opendata.arcgis.com/datasets/68b970bf65bc411c8a7f8f7b0bb7908d_0.csv, http://dvrpc.dvrpcgis.opendata.arcgis.com/datasets/68b970bf65bc411c8a7f8f7b0bb7908d_0.zip"
0818e875-4c2b-40df-aec4-926e8c2e274e,2016-08-12T19:11:31.680483,"AADB, Bicycle, Bicycle Count, Bike, DVRPC",Delaware Valley Regional Planning Commission (DVRPC),DVRPC Bicycle Counts,dvrpc-bicycle-counts,"DVRPC collects traffic volume, bicycle, and pedestrian counts at over 5,000 locations each year. The data is collected by the pneumatic tubes you see laying across the road. DVRPC also obtains traffic data collected by other entities and includes that data in its database as a public service. Traffic data is used by transportation engineers and planners, developers, market analysts, and may be of interest to the general public.  This file is updated nightly.

Use RECORDNUM in the location feature and DVRPCNUM in the hourly table to join the two.",Transportation,2016-08-09T17:51:08.315171,"api, geojson, CSV, shp","http://arcgis.dvrpc.org/arcgis/rest/services/Transportation/BicycleCounts/FeatureServer/0, http://dvrpc.dvrpcgis.opendata.arcgis.com/datasets/f8cf3245754c4b79a89a04a5d278a450_0.geojson, http://dvrpc.dvrpcgis.opendata.arcgis.com/datasets/f8cf3245754c4b79a89a04a5d278a450_0.csv, http://dvrpc.dvrpcgis.opendata.arcgis.com/datasets/f8cf3245754c4b79a89a04a5d278a450_0.zip, http://arcgis.dvrpc.org/arcgis/rest/services/Transportation/BicycleCounts/FeatureServer/1, http://dvrpc.dvrpcgis.opendata.arcgis.com/datasets/f8cf3245754c4b79a89a04a5d278a450_1.csv"
c0e52d62-6441-460f-a004-38c0d5a075da,2016-08-12T18:56:31.175526,"AADP, DVRPC, Pedestrian, Pedestrian Counts",Delaware Valley Regional Planning Commission (DVRPC),DVRPC Pedestrian Counts,dvrpc-pedestrian-counts,"DVRPC collects traffic volume, bicycle, and pedestrian counts at over 5,000 locations each year. The data is collected by the pneumatic tubes you see laying across the road. DVRPC also obtains traffic data collected by other entities and includes that data in its database as a public service. Traffic data is used by transportation engineers and planners, developers, market analysts, and may be of interest to the general public.  This file is updated nightly.

Use RECORDNUM in the location feature and DVRPCNUM in the hourly table to join the two.",Transportation,2016-08-10T13:06:34.792516,"api, geojson, CSV, shp","http://arcgis.dvrpc.org/arcgis/rest/services/Transportation/PedestrianCounts/FeatureServer/0, http://dvrpc.dvrpcgis.opendata.arcgis.com/datasets/d2599ca2c6834fb0a858507e2d7897ea_0.geojson, http://dvrpc.dvrpcgis.opendata.arcgis.com/datasets/d2599ca2c6834fb0a858507e2d7897ea_0.csv, http://dvrpc.dvrpcgis.opendata.arcgis.com/datasets/d2599ca2c6834fb0a858507e2d7897ea_0.zip, http://arcgis.dvrpc.org/arcgis/rest/services/Transportation/PedestrianCounts/FeatureServer/1, http://dvrpc.dvrpcgis.opendata.arcgis.com/datasets/d2599ca2c6834fb0a858507e2d7897ea_1.csv"
df58b28e-5617-4dff-9db1-f8aecf31b738,2016-08-12T18:34:47.679844,"DVRPC, Demographic, Employment",Delaware Valley Regional Planning Commission (DVRPC),DVRPC Demographic and Employment Forecast Data by Municipality - 2010 to 2040,dvrpc-demographic-and-employment-forecast-data-by-municipality-2010-to-2040,"As the region's metropolitan planning organization (MPO), DVRPC provides technical assistance and services to its member state, county, and local governments; the private sector; and the public. Delaware Valley Data is our periodic series of free data bulletins, data snapshots, and analytical data reports. This analytical data report provides revised 2040 and interim-year population and employment forecasts for the DVRPC regionâ€™s counties and municipalities. DVRPC prepared these forecasts in order to incorporate the results of the 2010 Census, account for the ongoing economic recession, and maintain a 30-year planning horizon. 2040 population forecasts were originally adopted by the DVRPC Board on January 26, 2012 and published in April 2012 in Analytical Data Report 18. On February 28, 2013, the DVRPC Board amended the 2040 and interim year population forecasts for Upper Merion Township in Montgomery County, Pennsylvania, to account for a significant residential development that was unforeseen when the 2040 population forecasts were adopted in January 2012. This amendment resulted in corresponding revisions to the population forecasts for Montgomery County and the DVRPC region as a whole. This amended analytical data report includes these revisions. This report also consolidates the adopted population forecasts for Princeton Township and Princeton Borough in Mercer County, New Jersey, which merged and became one municipality known simply as Princeton on January 1, 2013. Additionally, inconsistencies in some summary totals in ADR 18 caused by rounding were also corrected. The adopted population forecasts provided in this report will serve as the basis for DVRPCâ€™s planning and modeling activities, along with the 2040 employment forecasts that were prepared and adopted in September 2012.  NETS database for 2010 was used for employment data.  http://www.dvrpc.org/asp/pubs/publicationabstract.asp?pub_id=ADR019 http://www.dvrpc.org/asp/pubs/publicationabstract.asp?pub_id=ADR018-A Source of geographic boundaries: DVRPC","Budget / Finance, Health / Human Services",2016-08-12T18:32:32.444798,"api, geojson, CSV, shp","http://arcgis.dvrpc.org/arcgis/rest/services/Demographics/PopEmpForecastMCD/FeatureServer/0, http://dvrpc.dvrpcgis.opendata.arcgis.com/datasets/e1e3beb6aa144f2b8dd07693567077cc_0.geojson, http://dvrpc.dvrpcgis.opendata.arcgis.com/datasets/e1e3beb6aa144f2b8dd07693567077cc_0.csv, http://dvrpc.dvrpcgis.opendata.arcgis.com/datasets/e1e3beb6aa144f2b8dd07693567077cc_0.zip"
fa4927b4-abff-480c-878f-bb2dcfcc4fb4,2016-08-12T18:30:23.607132,"DVRPC, Land Use, Planning",Delaware Valley Regional Planning Commission (DVRPC),DVRPC 2010 Land Use,dvrpc-2010-land-use,"Every five years, since 1990, the Delaware Valley Regional Planning Commission has produced a GIS Land Use layer for its 9-county region. As it was in 2000, digital orthophotography was flown by DVRPC in 2010. Digitizing was done using these 2010 true-color aerials on the ESRI ArcGIS software platform at a 1:2400 (1 inch = 200 feet) scale.","Environment, Planning / Zoning",2016-08-12T18:28:16.078885,"api, geojson, CSV, shp","http://arcgis.dvrpc.org/arcgis/rest/services/Planning/LandUse2010/MapServer/0, http://dvrpc.dvrpcgis.opendata.arcgis.com/datasets/c614fd0ae78a4aeaad319ad2e1007cbf_0.geojson, http://dvrpc.dvrpcgis.opendata.arcgis.com/datasets/c614fd0ae78a4aeaad319ad2e1007cbf_0.csv, http://dvrpc.dvrpcgis.opendata.arcgis.com/datasets/c614fd0ae78a4aeaad319ad2e1007cbf_0.zip"
8970f7ea-53ee-42f5-9a6c-d41c54930824,2016-08-12T15:16:11.547970,"Bicycle, Circuit, DVRPC, Pedestrian, Trails",Delaware Valley Regional Planning Commission (DVRPC),DVRPC Circuit Trails,dvrpc-circuit-trails,"Greater Philadelphia is a region blessed with a variety of opportunities to create a connected network of multi-use trails, including both right-of-ways (ROWs) inherited from the area's long history as a hub of railroad activity and greenway corridors that follow the region's creek buffering and park systems. Some of these opportunities have been capitalized uponâ€”a number of significant trail segments already exist or are currently moving toward constructionâ€”but ""gaps"" still exist. In May 2012, DVRPC Board Member Terence Farrell and DVRPC Executive Director Barry Seymour joined Philadelphia Mayor Michael Nutter to celebrate the efforts of foundations, governments, non-profits, economic development professionals, and numerous other groups to fill these gaps and create an interconnected network of multi-use trails called The Circuit.This dataset reflects trail status and is a conceptual dataset - to be used at the regional-level only. Connect the Circuit",Transportation,2016-08-12T15:13:56.165117,"api, geojson, CSV, shp","http://arcgis.dvrpc.org/arcgis/rest/services/Transportation/CircuitTrails/FeatureServer/0, http://dvrpc.dvrpcgis.opendata.arcgis.com/datasets/c830cdb70f654c36bfd88eb7ed4bc424_0.geojson, http://dvrpc.dvrpcgis.opendata.arcgis.com/datasets/c830cdb70f654c36bfd88eb7ed4bc424_0.csv, http://dvrpc.dvrpcgis.opendata.arcgis.com/datasets/c830cdb70f654c36bfd88eb7ed4bc424_0.zip"
4bdeb3fb-4b33-4585-a29e-3c7b4ac86f79,2016-08-11T12:26:33.278680,"divisions, historic, political, ward",Azavea,Historic Political Wards & Divisions,political-wards-divisions,Historic ward and ward division boundary data from PASDA and Azavea archives. Attribute tables were modified to match across all years.,Elections / Politics,2016-07-27T21:26:43.647569,HTML,https://github.com/azavea/geo-data/tree/master/politcal-wards-divisions
c77a7c8d-9541-4992-8780-77b1032131fe,2016-08-10T13:15:00.952404,"AADT, DVRPC, Traffic Count, Volume",Delaware Valley Regional Planning Commission (DVRPC),DVRPC Traffic Counts,dvrpc-traffic-counts,"DVRPC collects traffic volume, bicycle, and pedestrian counts at over 5,000 locations each year. The data is collected by the pneumatic tubes you see laying across the road. DVRPC also obtains traffic data collected by other entities and includes that data in its database as a public service. Traffic data is used by transportation engineers and planners, developers, market analysts, and may be of interest to the general public.  This file is updated nightly.",Transportation,2016-08-09T17:43:47.165677,"api, geojson, CSV, shp","http://arcgis.dvrpc.org/arcgis/rest/services/Transportation/TrafficCounts/FeatureServer/0, http://dvrpc.dvrpcgis.opendata.arcgis.com/datasets/8eb412d170af43e58dbb9ff382e71777_0.geojson, http://dvrpc.dvrpcgis.opendata.arcgis.com/datasets/8eb412d170af43e58dbb9ff382e71777_0.csv, http://dvrpc.dvrpcgis.opendata.arcgis.com/datasets/8eb412d170af43e58dbb9ff382e71777_0.zip"
004f43ba-1c04-43a9-a695-dac2b9a580d7,2016-08-10T13:13:27.880080,"AADT, Congestion, DVRPC, Traffic Count, Volume, vehicle",Delaware Valley Regional Planning Commission (DVRPC),DVRPC Traffic Count Viewer,traffic-count-viewer,"Traffic Count Viewer is an online mapping application, which users can use to explore traffic count reports in different locations within the Delaware Valley, including Philadelphia. Users search by location (address, city, zip code, or place name) to view point features on the interactive mapping visualization of traffic records. Clicking on a point of interest or grouping multiple points on the map yields traffic count information tables, which includes: Date of Counnt ; DVRPC File # ; Type ; Annual Average Daily Traffic (AADT) ; Municipality ; Route Number ; Road Name ; Count Direction ; and From/To Locations, as well as a link to the detailed (hourly) report. Data tables are exportable as .CSV and detailed reports are available for export in multiple formats (including basic .doc and .rtf outputs.) Traffic count data is collected by the Delaware Valley Regional Planning Commission and other agencies. ",Transportation,2014-12-08T22:13:13.063910,HTML,http://www.dvrpc.org/webmaps/trafficcounts/
